{
  "certificate_id": "vdp-p2c-homoclinic-15664b600316",
  "claim_bearing": false,
  "configuration": {
    "configuration_id": "vdp-p2-homoclinic-v1",
    "path": "validation/rigorous/config/vdp_p2_homoclinic_v1.json",
    "sha256": "a1aca97d2fcf76f336dc06734c1ced25aeb9bd6b1bfa69b9dc8a6545846ce9ac",
    "status": "FROZEN_POST_STRICT_DESIGN_PRE_CERTIFICATE"
  },
  "continuation_bridge": {
    "bridge_id": "vdp-core-to-positive-bridge-v1",
    "path": "validation/rigorous/config/vdp_bridge_v1.json",
    "sha256": "2b62e6fc5625d3f5634d986f7e9cbe8199abfc45c7b97ca29e5efd464b5b69c7",
    "variables": {
      "a2": {
        "lower": {
          "denominator": "4",
          "numerator": "-1"
        },
        "upper": {
          "denominator": "4",
          "numerator": "1"
        }
      },
      "epsilon": {
        "lower": {
          "denominator": "5",
          "numerator": "4"
        },
        "upper": {
          "denominator": "5",
          "numerator": "6"
        }
      },
      "r": {
        "lower": {
          "denominator": "1",
          "numerator": "0"
        },
        "upper": {
          "denominator": "25",
          "numerator": "2"
        }
      }
    }
  },
  "created_at": "2026-08-27T23:21:25.315398+00:00",
  "final_status": "INCONCLUSIVE",
  "independent_replay": {
    "observed_distinct_machines": 1,
    "required_distinct_machines": 2,
    "status": "PENDING_REQUIRED"
  },
  "integrity_status": "PASS",
  "mathematical_status": "PASS",
  "nonclaims": [
    "A local mathematical PASS is not an aggregate theorem certificate.",
    "Independent-machine replay is pending and this certificate is not claim-bearing.",
    "The certificate does not assert uniqueness outside the finite parameter-following lifted multiple-shooting tube.",
    "It does not validate the P2d exact saddle charts, the P2e event atlas, or P3--P5.",
    "It does not prove temporal stability or dynamic Turing-pattern selection.",
    "It does not identify a finite-parameter canard.",
    "The strict executable bytes are not archived; their SHA-256 values are provenance records, while this certificate parses archived logs and does not rebuild or rerun the full grid.",
    "The evidence freeze is retrospective and the independent-machine replay remains pending; therefore this local certificate is not claim-bearing."
  ],
  "obligations": [
    {
      "id": "ENV.SOURCE_BINDING",
      "predicate": "Every local source, evidence artifact, and historical run source is hash-bound at an explicit Git commit.",
      "status": "PASS"
    },
    {
      "id": "ENV.P2C_HISTORICAL_RUN_RECORDS",
      "predicate": "All four archived P2c logs are bound to historical source commits, source hashes, the recorded CAPD commit, and recorded strict-binary hashes; executable bytes and build-environment replay are not asserted.",
      "status": "PASS"
    },
    {
      "id": "BRIDGE.FROZEN",
      "predicate": "The exact rational comparison bridge is the common gap-free domain of every P2c grid run.",
      "status": "PASS"
    },
    {
      "id": "P2.P2A_PREREQUISITE",
      "predicate": "The historical P2a certificate is schema-valid at its source commit and supplies the pre-source true-graph exclusion.",
      "status": "PASS"
    },
    {
      "id": "P2.P2B_JETS_PREREQUISITE",
      "predicate": "The historical P2b certificate is schema-valid at its source commit and supplies the weighted graph and half-orbit jets.",
      "status": "PASS"
    },
    {
      "id": "P2.P2BK_PREREQUISITE",
      "predicate": "The historical P2bK certificate is schema-valid at its source commit, its true-source atoms pass, and its source interface is byte-compatible with the current P2c theorem snapshot.",
      "status": "PASS"
    },
    {
      "id": "P2.HOMOCLINIC_CONFIG_FROZEN",
      "predicate": "The post-design retrospective P2c evidence contract was frozen before this local certificate was assembled.",
      "status": "PASS"
    },
    {
      "id": "V2.HOM.BRANCH",
      "predicate": "A gap-free 32x128x4 cover, all 44,416 internal faces, and the frozen core anchor identify one selected branch unique in the finite lifted multiple-shooting tube.",
      "status": "PASS"
    },
    {
      "id": "V2.HOM.FIRST_HIT",
      "predicate": "The P2a pre-source exclusion, continuous strict sign tubes, and final U-positive flow box prove the selected event is the first nonzero symmetry hit.",
      "status": "PASS"
    },
    {
      "id": "V2.HOM.TRANSVERSE",
      "predicate": "Every selected endpoint is nonzero and has strictly positive shooting determinant and event transversality margins.",
      "status": "PASS"
    },
    {
      "id": "V2.HOM.TAILS",
      "predicate": "Exact composition of certified source/root jets with P2b half-orbits gives explicit weight-one-fifth C2 bounds on both infinite tails.",
      "status": "PASS"
    },
    {
      "id": "V2.HOM.MIDDLE_C2",
      "predicate": "Continuous CAPD C2 enclosures, event-time centering, local pre-source composition, and reversibility give the full-real-line global weighted bound.",
      "status": "PASS"
    },
    {
      "id": "V2.HOMOCLINIC",
      "predicate": "All five P2c mathematical atoms pass, yielding the selected C2 homoclinic branch, first hit, transversality, and explicit global weighted parameter-two-jet bound.",
      "status": "PASS"
    }
  ],
  "parameter_box": {
    "box_id": "vdp-positive-box-v1",
    "path": "validation/rigorous/config/vdp_box_v1.json",
    "sha256": "ce84e84e4e2e53563125497df4ad2df98a533437b04b35bee042e9b04ea1c735",
    "variables": {
      "a2": {
        "lower": {
          "denominator": "4",
          "numerator": "-1"
        },
        "upper": {
          "denominator": "4",
          "numerator": "1"
        }
      },
      "epsilon": {
        "lower": {
          "denominator": "5",
          "numerator": "4"
        },
        "upper": {
          "denominator": "5",
          "numerator": "6"
        }
      },
      "r": {
        "lower": {
          "denominator": "25",
          "numerator": "1"
        },
        "upper": {
          "denominator": "25",
          "numerator": "2"
        }
      }
    }
  },
  "prerequisites": {
    "p2a": {
      "claim_bearing": false,
      "final_status": "INCONCLUSIVE",
      "integrity_status": "PASS",
      "mathematical_status": "PASS",
      "path": "validation/rigorous/results/vdp_bridge_v1_p2a_local_graph.json",
      "required_atoms": {
        "V2.WU.COARSE_GRAPH": "PASS",
        "V2.WU.FRAME_BLOCK": "PASS"
      },
      "scope": "V2_LOCAL_GRAPH_KERNEL",
      "sha256": "192b351c3f153080d82bc856fa3c667388dc16c7b4cf0cfa8568fa347bcaf6be",
      "source_bindings_verified_at_recorded_commit": 27,
      "source_commit": "83bd821847e733ee6f2caf3bbb3fb2cee153daea"
    },
    "p2b": {
      "claim_bearing": false,
      "final_status": "INCONCLUSIVE",
      "integrity_status": "PASS",
      "mathematical_status": "PASS",
      "path": "validation/rigorous/results/vdp_bridge_v1_p2b_jets.json",
      "required_atoms": {
        "V2.WU.JETS": "PASS",
        "V2.WU_GRAPH": "PASS"
      },
      "scope": "V2_P2_JETS_KERNEL",
      "sha256": "07b0949a3d403c0c0a85a4a157b86d7b32cce3ff0348aeffa1db474d441fca07",
      "source_bindings_verified_at_recorded_commit": 38,
      "source_commit": "ae88ae0fb47dc43329ad2b66bd465576994df23c"
    },
    "p2bk": {
      "claim_bearing": false,
      "final_status": "INCONCLUSIVE",
      "integrity_status": "PASS",
      "mathematical_status": "PASS",
      "path": "validation/rigorous/results/vdp_bridge_v1_p2b_kato.json",
      "required_atoms": {
        "V2.PHASE.KATO_INTERFACE": "PASS",
        "V2.PHASE.TRUE_SOURCE": "PASS"
      },
      "scope": "V2_P2_KATO_KERNEL",
      "sha256": "c67cce575caa396eba5b4388e8ba9a0c9d73fd702f69911d64c878f57f27bff3",
      "source_bindings_verified_at_recorded_commit": 45,
      "source_commit": "91007a88395290a594ba88047ff6ae45b9cebb80"
    },
    "p2bk_source_compatibility": {
      "common_extract_sha256": "490bc36b38d3bb65a937e0b2a363c38c5ef687d7316e7019fbc3928266717682",
      "current_commit": "33a830298df9c58f4dee5530e30d3bdf6b9874f4",
      "historical_commit": "91007a88395290a594ba88047ff6ae45b9cebb80",
      "status": "PASS"
    }
  },
  "raw_evidence": {
    "branch_cover": {
      "cells_passed": 16384,
      "cells_total": 16384,
      "common_faces_passed": {
        "a2": 16256,
        "epsilon": 12288,
        "r": 15872,
        "total": 44416
      },
      "determinant_hull": [
        "35.189379305083953",
        "287.48895667960522"
      ],
      "frozen_core_anchor": "PASS",
      "grid_geometry": {
        "a2_cells": "A_j=[(j-64)/256,(j-63)/256], 0<=j<128",
        "epsilon_cells": "E_k=[(8+k)/10,(9+k)/10], 0<=k<4",
        "gap_free_box_complex": "PASS",
        "r_cells": "R_i=[i/400,(i+1)/400], 0<=i<32"
      },
      "maximum_contraction": "0.48505318768286615",
      "maximum_face_ratio": {
        "a2": "0.84468357665770233",
        "epsilon": "0.831086370582925",
        "r": "0.83572414542914675"
      },
      "maximum_inclusion": "0.81163070510064661",
      "status": "PASS",
      "uniqueness_scope": "finite parameter-following lifted 38-dimensional multiple-shooting tube"
    },
    "compact_middle": {
      "cells_passed": 16384,
      "cells_total": 16384,
      "continuous_hulls": {
        "centered_tube_xi": [
          "-9.7024614326336689",
          "0.017036600914542177"
        ],
        "half_time": [
          "9.6050962330163951",
          "9.7024614326336689"
        ],
        "physical_state_P": [
          "-0.45162005597156318",
          "6.3575562290451844"
        ],
        "physical_state_Q": [
          "-3.356072534474043",
          "0.084760500832987931"
        ],
        "physical_state_U": [
          "-1.2754209644411874",
          "5.0555221504031378"
        ],
        "physical_state_V": [
          "-8.2026248332266718",